essay_id,full_text,score,cluster,cluster_confidence,underrated_pct,overrated_pct,total_error
d8d8de9,"The planet called "" Earth Twin"" is called Venus. Venus is the most alike planet to earth density and size. Another name for Venus is the ""Evening star"" because not only its the closest to look liike eath density ans size it also the closest planet to earth. So at night you can look you and see Venus. Venus even had some space craft send to the planet but noe of the survived the landing on the planet over three decades.

This planet surface and atomspher both have extream conditons. The atomspher of venus is 97 percent carbor doxide and the clouds rain corrosive surface acid. And the surface is over 800 degrees fahreheit and the peressure is 90 time than earth. Even thought Mercury is closter to the sun Venus has the hottest surface. And thats because of the weather patters and the voclanos. Or it because the powerful earth quakes or the lighting strike.

The NASA want to still try to send thing to this planet it lear thing they cant touch. They know the probly they have to solve before they really send anything up there. There was people in the 1800s trying to figur out Venus mistorys and people even going over that to see if they miss anything. Alot of researchers was trying to past the challenge but didnt know how because the heat of the planet was messing upthe rocket they was sending and there tryinh to fiuger out that problem now.      ",1,2,0.7823781967163086,0.0,0.0,0.0
bbfa079,"There are many thing you don't know about venus and i will tell you some things you should know about Venus. Well, Venus sometimes called the "" Evening star"" is one of the bighest points of light in the night sky. If you didn't know venus is actually a planet. In the solar system Venus is simple to see from the distant but safe vantage point of earth it has proved a very challenging place to examine more closely. Venus is the closet planet to earth in terrms of density and size. In this article there are many things you don't know about venus. Venus is more than three decades. Venus has the hottest surface temperature of any planet in our solar system, even though Mercury is closer to our sun. The vaule of returning to venus seems indisputable. Venus can sometimes be our nearest option for a planetary visit, a crucial consideration given the long time frames of space travel. Venus from a ship orbiting or hoveing safely far above the planet can provide only limited insight on ground conditions because most forms of light cannot penetrate the dense atmosphere, rendering standard forms of photography and videography ineffective. NASA is working on other apporaches to studying Venus. ",1,2,0.8150278329849243,0.0,0.0,0.0
cfff1cf,"Have you ever wondered about Venus? This planet is somthing that we as humans haven't figured out yet. We are facing the challenge of Venus, it is really valued not only because of the facts and information we get out of this planet. Instead, humans are curiose and looking for more evidence of what we are going to face in the futur. We should learn more not only on the outter shell, but more deeply in the inside.

Venus is the second planet in the our solar system(Milkyway). Also ot is one of the brightest points in the sky at night. As the closest plant to Earth in terms of size, density, and distane. The surface of it is full with valleys, mountains, and craters. Not even one single spacecraft have reached to it before. 97 percent of the atmosphere is carbon dioxide, forming a blanket for the planet. This planet has the highest temperature in the whole entire Milkyway. NASA(National Aeronautics and Space Administration) have not stop sending spacecraft to land on Venus.

If we could lend on Venus later on in the generation, could there be any living organisum that lives on that plante? There could be a possible chance since Earth is not the only planet in space. There are more things tha we need to discover. You would never know if there are creatures like ous that have a abiliy to explore space. We should keep trying even if there is only a 0.0000001 chance.",1,2,0.7863932847976685,0.0,0.0,0.0
d39dbc5,"The author should continue studying Venus despite the dangers it presents. because in the text it talks about how they had to stop studying Venus since the spacecraft would not survive more than a few hours.

What they know about Venus is how thick its atomosphere is 97 percent carbon dioxide, and its challenging are the clouds of sulfuric acid. The planets surface the average surface is 90 times much more then on earth. And it has the hottest temperature in the solar system even if Mercury is the cloest its not as hot as Venus.

Since no spacecraft survived the landing more than a few hours. They would stop because it wouldn't survive. It explains why they haven't got a spacecraft to stay at Venus. And what I would have to guess on why they didn't survive is probadly because how intense Venus really is. Now by intense I mean how strong the planet really is. Now more then 3 decades Venus has not had a spacecraft there. They haven't gave up. But they're trying to find a way.

NASA is working on other ways to study Venus. NASA thought about sending humans to study Venus. But the conditiond of venus makes it hard, because they have to orbit the planet and they cannot take samples like rock or gas. The only thing they could get to study Venus are images.

I still think the author should continue on studying Venus despite the dangers it presents.   ",2,2,0.8652229309082031,0.0,0.0,0.0
6edf6de,"Im going to tell about how the author of the article ''The Challenge of Exploring Venus"" is trying to convince people to explore and stuying one of our 8 plants called ""Venus"". He starts off by geeting in detail with describing how vevus is by stating "" Venus sometimes caleed the Evening Star,is one of the brightest points of light in the night sky,and saying venus is the second plant fro our sun. Earth in terms of density and size,and occasionally the closet in distance too. He also discribed the plant as a cloud-draped world, and says maybe this issue explains why not a single spaceship has touched downn on venus in more than three decades

The author also gets into some math into this by breaking down some percentages that venus has compared to other plants by saying. ""A thick atmosphere of almost 97 percent carbon dioxide blankets venus "". he also says that one the plants surface , temperatures average over 800 degrees Fahrenheit, and theatmosphere pressure is 90 times gretaer than what they have experienced on earth. Venus has the hottest surface tempertature of many plants in our solar system, even with mercury being closer to the sun. He basically telling us about the percentages and the deepest amont of venus and other plants we didnt reaserch about.

In more of the storyhe tells you the things yo are exprcted to see on venus. Venus was covered largely with oceans and could have supported various forms of life,just like earth. The planet has a surfae of rocky sediment and includes familiar features suck as valleys, mountains, and craters. He changes the subject and goesminto the NASA and how they have ideas on sending humas to study venus. he describes how going out there would be like by saying imagine a blimp-like vehicle hovering 30 or so miles above theroiling venusian landscape. Also at thirty plus miles above the surface, temperatures would still be toasty around 170 degrees fahrenheit, but tha air pressure would be close to that of sea level on earth",2,2,0.8156622052192688,0.0,0.0,0.0
97c2344,"Going to Venus would be extremly dangerous. With a thick atmosphere of almost 97 percent carbon dioxide blankets Venus. Venus's clouds have highy corrosive sulfuric acid. Temperatures are over 800 degrees Fahrenheit. Venus's atmospheric pressure is 90 times greater then what we have here on Earth.

Venus could be worth visiting. Astronomers say that Venus once was the most Earth-like planet. Venus was probably covered with large oceans. Venus could have supported many forms of life. It is simply to dangerous to land on venus. Even 30 miles above Venus's atmosphere is dangerous. Although it is survivable by humans, having the right equipment for the job is key. Most metals would melt right away if they were to get close to Venus. Silicon carbide has been tested in a chamber of simulation of Venus's atmosphere. It lasted up to three weeks in the chamber.

Going to Venus would be extremly dangerous, but it would be worth trying to find out if there was actually any living life on Venus. Any sample from Venus's ground would be outstanding. It is just simply to dangerous for that to happen.   ",2,2,0.764927327632904,0.0,0.0,0.0
eb1d4a6,"I'm going to talk about the article ""The Challenge of Exploring Venus"". By this unknown author who wrote this. My name is PROPER_NAME and this will be an essay so bare with me. It will be long and show how the author supports the idea. Without a further due, lets jump right into this essay.

The author talks how the idea of people can adpat to the conditions of Venus and settle there like our home planet Earth. There are some problems that he think are challenges. The planet is 90 times the amount of pressure we have on Earth. Most of the air is carbon dioxide blankets that covers 97 percent of the planet's thick atmosphere. The temperature is around about to 800 degrees on the planet.

Venus that has the hottest surface temperature that would melt anything on contact including people. Also, it would crush you or anything else like a piece of paper. There is also bad weathering that cause problems. Like for example: erupting volcanoes, powerful earthquakes, and frequent lightning strikes.

On the postive side, we can make a vehicle that will let us float above the fray. Use solar energy to power the vehicle to float. We can avoid the unfriendly conditions on the ground. The degress will be around toasty at around 170 degrees. The pressure will be around sea level on Earth. The radiation would not exceed Earth levels.

This why I think the authors idea is good. It can help us show how humans are progressing through the years of tech advancements. This world will become someday extinct and we will somehow surivive. NASA will always find a way to expand. Thank you for reading this essay and I hope you enjoy.",2,2,0.8293592929840088,0.0,0.0,0.0
99073b3,"""Our travels on earth and beyond should not be limited by dangers and doubts but should be expanded to meet the very edges of imagination and innovation.""

The author supports the idea of exploring Venus. The author shows many intrests the planet but also in the technology used to explore it, from ""Venus being earths twin"" and ""possibly supported life with large oceans long ago"" to ""mechanical computers"" that can potentially last in the harsh environment. The author also wants to know the options for making this mission both ""safe and scientifically productive"". One of NASA's possible solutions is to allow scientist to float about 30 or more miles above the land to avoid most of the storms and the harsh ground conditions, The conditions will still be rough with tempratures of 170 degrees fahrenheit but the pressure would be close to the same pressure of earths sea level.

In conclusion Venus may be a hard planet to study but our scientist are working hard on many solutions to traveling to that harsh planet.",2,2,0.8280678987503052,0.0,28.57142857142857,28.57142857142857
6f65423,"The author supports this idea by introducing us to the planet and stating key points about Venus early on in the passage. In paragraph one he says, ""In our solar system Venus is the second planet from our sun."" and that's showing us that the author is intrested in studying Venus. In paragraph two he begins to talk about the different speeds in which Venus, Earth and Mars travel. The author states in the third sentence of paragraph two, ""These differences in speed mean that sometimes we are closer to Mars and other times to Venus"".

As the author states in the third paragragraph, ""On the planet's surface, temperatures average over 800 degrees Fahrenheit..."" Venus is the hottest planet in our solar system. The author has to be fully intrested in Venus to know this much about the planet. You will learn that Venus is a dangerous planet and not even metal can survive on Venus's surface. The author states in paragraph two, ""Maybe this issue explains why not a single spaceship has touched down on Venus in more than three decades"". Venus is so dangerous that in order to visit the planet you can't even land, you would have to float about 30 miles from the ground.

In conclusion, Venus is not impossible to visit in fact NASA is still working on getting astronauts there with different approaches. As the author states in paragraph seven, ""For example, some simplified electronics made of silicon carbide have been tested in a chamber stimulating the chaos of Venus's surface and have lasted for three weeks in such conditions."" so, Nasa is still working on getting humans there. In paragraph eight it states that, ""Striving to meet the challenge presemted by Venus has value..."" meaning that venus is a special place and getting humans there will be exciting. So many humans are curious of what's on Venus because it's so hot there and getting humans there would be a big accomplishment. ",3,2,0.8588916063308716,0.0,0.0,0.0
3902084,"""The Challenge of Exploring Venus"" is about how dangerous other planets are to humans but in this passage they specifically talked about Venus which happens to be one of the most dangerous planets. Venus is the second planet to the sun which makes the surface very hot and dry and so it doesn't allow for us humans to land there easily and just explore. The passage even says ""Not easy conditions, but survivable for humans"" this shows how we can land on Venus and survive but the conditions make it so hard that humans usually die after a while. and even though Venus is a dangerous planet I understand why people explore the planet regradless.

Scientists and NASA have been trying to figure out if we can survive on a different planet or if would be able to build there and have people live there because the world could get over populated. So, when they search new planets it's not for fun its because they want to see what else is out there and as dangerous as conditions may be I repsect the people who go out and discover things we didn't know existed. As of right now the only way to find out more about Venus is by going there, however, ""NASA is working on other approaches to studying Venus, some simplified electronic made of silicon carbide have been tested in a chamber simulating the chaos of Venus's surface and have lasted for three weeks in such conditions. Another project is looking back to an old technology called mechanical computers."" These projects could work one day and we wouldn't have to risk lives to find something new, we could just use the resources found here on earth.

The very last sentence of the passage says ""Our travels on Earth and beyond should not be limited by dangers and doubts but should be expanded to meet the very edges of imagination and innovation. I strongly agree because if we didn't take risks and put ourselves out there we wouldn't have half of the stuff we use on a daily basis. Having the technology we have today we will be doing great things one day with the amount of knowledge we have rn and we will only build off of what we have.",3,2,0.8712665438652039,0.0,0.0,0.0
05c94e5,"Studying Venus

Planets are a very interesting, Earth, Mars , Venus, and others are all planets in the solar system. Venus is an interesting one, and one that not much is known about. This is why Venus must be explored and have discoveries made. Venus is a planet that is worhty of being studied and there are reasonable factors as to why that is. The planet Venus would save time while visiting it, it is much like Earth, and if it was researched many important discoveries about the weather could be made.

Venus is worth being studied because it is one of the closer planets to Earth. It is a planetary neighbor to earth. In the article ,""The Challenge of Exploring Venus"" it states,"" Furthermore, recall that Venus can sometimes be our nearest option for a planetary visit, a crucial consideration given the long time frames of space travel"" (Par. 4).Because Venus is a closer planet to Earth time could be saved and there would not be a worry about time being lost as if traveling to a different planet.

Secondly, Venus has similarties to Earth, ""The planet has a surface of rocky sediment and includes familiiar features such as valleys, mountains, and craters"" (Par. 4). Just like on Earth Venus also includes the same quality land features. Going to Venus and discovering the way the land features form would be a magnificent thing to discover and being able to see how the earthquakes and natural disasters appeasr.

Lastly, while exploring Venus, reasoning for the temperatures and dangers of Venus could possibly be prevented. If someone was to discover how to prevent the dangerous factors then maybe there would not be a problem to land on Venus. Making that discovery is important and would help scientists learn more about Venus. The article states,"" On the planet's surface, temperatures average over 800 degrees Farenheit, and the atmospheric pressure is 90 times greater than what we experience on our own planet. These conditions are far more extreme than anything humans encounter on Earth""(Par. 3). Taking time to discover Venus could be a great thing.

Although Venus is a dangerous Planet with crucial temperatures, exploring the planet could be very beneficial to scientists and multiple discoveries could be made. Venus is a planet that is worhty of being studied and there are reasonable factors as to why it is. The planet Venus would save time when visiting it, it is much like Earth, and if it was researched many important discoveries about the weather could be made. Contributing to the study of Venus may be challenging, but in the end would be quite beneficial and would make a difference. ",3,2,0.8802578449249268,0.0,0.0,0.0
3c12de3,"The Trip to Venus

Have you ever been looking up in the sky and see somthing that youve never seen before? Well thers a good chance that was Venus. Venus is the one of the neighboring plantets next to earth and also the most simular. In "" The Challenge of Exploring Venus"" the author talks about how NASA has been studying Venus and there plans on it.

First of all, Venus is the second planet from the sun and is somtimes called the ""Evening Star."" In the passage the author tells of how Venus is called Earths ""twin"" because of how simular both a made, with both of them having around the same size and density.

Next, the author was able to tell why getting to Venus was the actuall hard part. Venus has been hard for NASA to figure out mainly because of its atmosphere and ground conditions. In the story the author describes how Venus's atmosphere is mainly made up of carbon dioxide and that the clouds on Venus are made up of sulfuric acid which is corrosive. Then if you where to make it to the ground the avergae temperature is said to be around 800 degrees farenheit. So thats why in the passage he described Venus as inhospitable.

Finally, NASA has been trying to make trips to Venus but most dont make it through the atmoshere or only last a few hours on the ground. But as said by the author NASA has been brainstorming ways they could get to Venus and collect data. One idea mentioned by the author is that NASA would to make a blimp like object that houses people in it to hover above Venus's atmoshpere making them unharmed while they collect data. Another idea is that they would use technology back from WWII which didnt use electronics but gears so that putting that on Venus's atmoshere wouldnt break down as fast due to it's conditions.

In conclusion, the author states good evedince that in the future we might be able to know more about Venus and maybe even send people there. With knowing more about its physical properties NASA might be able to do more missions's there and maybe even send a person there.",3,2,0.8293147087097168,0.0,0.0,0.0
7617ff3,"Does the author of ""The Challenge of Exploring Venus"" really support the exploration of Venus? The facts and the reasoning in the authors article shows strong supporting details that they in fact want to explore Venus.

So therefore, in paragraph 4. The text states,""astronomers are fascinated by venus becuase it may well once have been the most Earth-like planet in our solar system. Long ago, Venus was probably covered largely with oceans and could have supported various forms of life, just like Earth"", the author is stating how Venus might be able to save us in the near future. For example, if a natural disaster happened and human kind was in danger, where would we go? As the author states Venus is very similar to Earth, if we do the reasearch and get the materials to be able to live on Venus it could ultimately save the human race.

Also, there are still some downfalls about Venus's condictions, in paragraph 6 it states, ""peering at Venus from a ship orbiting or hovering safely far above the planet can provide only limited insight on ground conditions because most forms of light cannot penetrate the dense atmoshpere, rendering standard forms of photography and videography ineffective."". This is the author giving evidence that there are still complications to be fully awhere on what is on Venus, there could be a possibility that Venus is inhabitible.

In conclusion, yes, the author does support the exploration of Venus. The author gives many reasons why we should and why it is more than likely be a planetary visit. Even though there is many downfalls about Venus it could possibly be very helpful in the near future.",3,2,0.8847207427024841,33.33333333333333,0.0,33.33333333333333
33b606a,"The claim that ""Venus is a worthy pursuit despite the dangers it presents"" is not well supported by the passage. Throughout the passage the author explains why Venus is exceptionally hard to explore, why it hasn't explored it in 3 years, and even the intrigue that it causes. It doesn't explain the benefits of exploring Venus and it doesn't explain the benefits of our curiosities. The passage explains more of the dangers of exploring Venus than why it is worthy to be pursued by any reason other than curiousity.

The first paragraph introduces the reader to the planet Venus describing it as an ""Evening Star"" that is easy to view from afar, but challenging to view up close. The author starts with these statements, leading the reader to the question ""Why is it challenging?"". Through the second and third paragraph it explains why it was explored and why those missions failed. This gives the reader knowledge on what Venus is and a picture of what Venus looks like, while also explaining some of the many reasons that Venus can't be explored.

In the fourth, fifth, sixth, and seventh paragraphs we see a shift in view point, where instead of focusing on the expected ""Why should or shouldn't Venus be explored?"" the author then moves to the topic of ""Why are scientists wanting to explore Venus?"". The answer? The author explains that the reason behind all of the searching for ways to explore Venus is merely curiousity. The author also explians the approaches to explore Venus, that NASA is taking, because scientists are curious. In the paragraphs it doesn't suggest that exploring Venus is worthy, as it only explains why exploring Venus has failed, how any missions now would fail, and what NASA is doing to approach their curiousity.

In the conclusion paragraph, the author explains that the challenge that Venus presents is what fuels the curiousity of many scientists. It also states that ""Our travels on Earth and beyond should not be limited by dangers and doubts..."" proving that the author was not focused on proving that it is a worthy cause but more of saying, we should not be grounded because it's dangerous.

The author's suggestion is not well supported by the claim, as it has been shown that the author only focused their attention on how dangerous and scary Venus is and not on how exploration of Venus could be beneficial to understanding and history. The author's claim would have been better supported had they focused on the benefits of exploration and why the attempts to explore Venus are important, other than the filling the questions that are asked about the hardly known planet. ",4,2,0.802157998085022,0.0,0.0,0.0
