essay_id,full_text,score,cluster,cluster_confidence,underrated_pct,overrated_pct,total_error
56ae3e1,"The Challenge of Exploring Venus, a article about the risks and benifits of exploring such a inhospitable planet. Yet, the Author does provide some insight on what humans could and can do to survive an expedition to Venus. Giving information about what NASA is doing to surive the conditions of Venus and other ideas that could help to properly understand and learn about Venus. The author does support his idea with very good points, but it does depend on how well those points stand.

One thing that is quite obvious is the fact that the author is biased on their idea. Which is not really suprising when their article is entirely based on trying to convince others that sending missions over to Venus is a good idea. They first describes the conditions of Venus itself, showing insight on why people haven't sent expeditions to Venus. They even state the Venus is quite inhospitable and does not support any suitable life for humans. The author tries to provide a window into both worlds, one where scientists try to find a way to explore Venus, another where people just know that Venus is not a place for people to live. They try an approach to shoot down common fears on why exploring Venus is a bad idea, bringing up one problem and then answering it with quick and simple methods. One idea from NASA is to have a blimp-like vehicle float 30 miles above the surface to survive from most of the heat and acidic atmostphere. Then they bring up another issue about exploring Venus, the technology. Where their idea is to use old 1800s mechanical computers to survive the climate, but to also provide a way properly explore the surface without the issue of frying modern computers. The author brings many solutions to many problems, so that the exploration of Venus could be possible by brining ideas together and have those ideas be the basis of a mission to learn more about this fiery of planet of our solar system.

The solutions brought up by the author show a new perspective, or bring insight on one that people already have, about sending people to Venus to quench a thirst for exploration. Where the idea of having a blimp float 30 miles above the surface to survive the deadly climate. Having old 1800s computers to play an important role in helping to learn about the planet, where heat or acid could destroy an iPhone or a laptop in seconds. Brining machines in to do the exploring for us with technology that hasn't been used in little over two centuries. The risks are great, but the benifits of learning about a planet that hasn't properly been explored for the entirety of our existance could enter people into a new age of exploration based on curiosity and adventure. Just as the author states in paragraph 8, ""Striving to meet the challenge presented by Venus has value, not only because of the insight to be gained on the planet itself, but also because human curiosity will likely lead us into many equally intimidating endeavors."" The author greatly supports their idea to explore Venus, with some quick and simple methods, but also with the idea of bringing people together to go out and explore further than Venus itself.",4,2,0.8477530479431152,0.0,0.0,0.0
47b45a7,"Venus is often referred as the Earth's ""twin"", mainly because of its similar density and size. Its close distance to the Earth makes an easy planet to explore. However, it presents a challenge because of the conditions.

The author shows the study of Venus is a worthy pursuit because of its similarities with the Earth. Astronomers believe Venus might have been covered with oceans and contained various forms of life. It has other features that resemble those of the Earth, including a surface or rocky sediments and formations like valleys, mountains, and craters. Its proximity to earth makes it the nearest option for a planetary visit.

The author also gives examples of ways Venus can be explored even with the dangers it brings. The NASA is working on solutions that will allow humans to visit the planet. A vehicle that hovers over the planet will avoid ground's conditions. Temperatres would still be high at 170 degrees Fahrenheit, the air pressure would be similar to that of sea leve. There would be plenty of solar power and radiation does not surpass Earth levels. These are hard conditions that are still survivable for humans.

However, using a spacecraft as such does not allow for photographs, videos, or rock and land samples because of the distance. Consequently, researchers are working on innovations that will enable machines to last longer. The NASA, on its side, is working on simplified electronics made of Silico Carbide that are tested in a chamber that simulates Venus's harsh conditions, and have lasted three weeks.

Another project uses the old technology of mechanical computers, which played and imprtant role during World War II. Unlike modern computers, that are quick but delicate, these do not require electronics at all. Instead, they are made of mechanical parts that can be made to endure pressure, heat, and other forces.

Though a dangerous task, the exploration of Venus is worth the risk. The author thinks the challenge has value, because ""human curiosity will likely lead us into many equally intimidating endeavors"". His examples of similarities with the Earth and inventions made by researchers show that the mission should be conducted, because now there are solutons to the problems the conditios of Venus causes.",4,2,0.8555082082748413,0.0,0.0,0.0
729d99e,"How many people do you know that would like to go to the Moon? Many I'm sure, but why would they want to risk their life just to see another planet? Well, the author of ""The Challenge of Exploring Venus"" has a theory that this exploration is a very worthy pursuit despite its many visible challeneges and dangers.

The authors first allegation is that human curiosity is taking over and will lead us to many finds beyond our planet of Earth. While you may not worry about Venus and what it looks like every day, just think, wouldn't it be facsinating if there was another hospitable planet besides Earth? Venus was once the most earth-like planet in our solar system, and that statement is what makes astronomers so intrigued by the idea of someday going there. Venus is known to have a sufrace of rocky, valleys, mountains, and craters, so what would make the mission safe for humans and effective for scientists?

The author also says, although nondeliberately, that humans have the supplies to one day explore Venus, but doesnn't make the effort to. The author makes the conclusion that ""peering at venus from a ship safely far above"" isn't going to cut it. The words used by the author are supported because not only can you not get reliable resources, they could be ineffective and just a waste of time. Instead, researchers need to take the challenge and work on innovations that allow machines to last long enough to contribute to the exploration of Venus.

While the author believes there are a number of dangers in the exploration, it is stated that instead of feeling like there is a risk to you, think of them as challenges that you will one day overcome. As of now NASA is simplifying electronics because modern technology may be quick and powerful, but it becomes delicate in aggrivating physical conditions such as heat.

Overall, the author is stating that despite dangers presented, exploring Venus could be a great investment for the long run. So next time you are asked of what the future could hold for you, just think it may be a trip to Venus.                      ",4,2,0.8231327533721924,14.285714285714285,0.0,14.285714285714285
8fe06d7,"The author doesn't fully support his idea that studying Venus is a worthy pursuit despite the dangers. He displays too many downsides of the exploration. He frequently brings up how risky it could be. The benefits are acknowledged, but briefly. The author spends too much time focusing on how the conditions are far from easy when he should have been focusing on why traveling to Venus is worth it. His idea is that the trip is worth it, but most of his writing describes why it is not.

The author first brings up the environment of the planet. He describes the hot temperatures, stating how it averages to be over 800 degress Farenheit. He also adds in how it has the hottest surface, despite Mercury being closer to the sun. This is obviously way too hot for human beings. Then, he discusses that the atmospheric pressure is 90 times stronger than that on Earth. This environment is much more extreme that anything we're used to. Plus, Venus experiences earthquakes, lightning, and volcanoes that are way more powerful than the ones on Earth. The author provides information on all the reasons why our species could not live there.

Furthermore, he admits that NASA does not even have the needed equipment to safely and effectively travel to Venus. He only mentions that they are currently working on it. The author gives the idea that Venus could be studied from up above, in a vehicle hovering miles away from the surface. This way, scientists could get an insight on what's going on down there. However, doing that would prevent seeing most light, since it isn't able to penetrate the atmosphere. Even though the author does say better approaches are being worked on, no machines are completely ready. We simply don't have the required technology to keep humans safe on their expedition.

Finally, the author doesn't support his claim that going to Venus is worth it because the pros of traveling there are kept at a minimum. In his writing, he failed to give important reasons on why going there is essential. He does bring up that it's fascinating to astronomers due to how similar it could have been to Earth long ago. However, the potential similarity it could share is not a reason to risk lives to explore it. Yes, it is beneficial to study planets other than ours, but when it's so dangerous, it shouldn't be done. If the author wants to convince people that the pursuit should be taken even though it is unsafe, he should list more reasons why than just the fact that it's fascinating.

To conclude, the author poorly explained the reasoning to his arguement. He spent too much time hightlighting all the dangers presented. He should have gave readers better valid points to travel to Venus. Instead, he repeatedly wrote about the extreme conditions, or the lack of proper technology. Too much time was spent on the wrong side of his claim. The author should have supported his idea with reasons other than just pure curiousity. The cons outweigh the pros. ",5,2,0.9051659107208252,0.0,0.0,0.0
c11476d,"The author made it clear to us why they feel like we should persue Venus. The author had many facts to back up his idea that exploring Venus is worthy but can be dangerous. The author described many aspects of what could happen if we go to Venus. The author is very interested about Venus and gave a thorough explanation of why we should pursue Venus despite the dangers by giving supportive details of how it relates to planet Earth.

The author gives descriptive details on how Venus is just like earth and why we should go there in paragraph 4. The authors says that ¨The planet has a surface of rocky sediment and includes familiar features such as valleys, mountains, and craters¨. This part of the text makes it to where Venus is a safe place to go because it ¨includes familiar features¨ as earth does. Which makes the reader believe that their is another planet like earth out their in the Solar system. Venus having ¨valleys, mountains, and craters¨ shows how closely related the planet Venus is to Earth. By the author putting this into the text give us a visual of what Venus really looks like if we touch down and started to build a civilization their.

The author gives the reader a realistic condition of Venus of why it is worth it but dangerous. In paragraph 5 towards the bottom the authors describes the conditions by saying ¨...temperatures would still be toasty at around 170 degrees Fahrenheit, but the air pressure would be close to that of sea level on earth./ Not easy conditions, but survivable for humans¨. The author gives us a little scare of how it is dangerous because the temperature levels is ¨at around 170 degrees¨. That is very high and seems that no one would be able to survive there. The author also says ¨air pressure would be close to that of sea level on Earth¨ which is saying that the air level of 170 degrees is as close sea level so we could pontentially survive it. The author ends is by saying ¨Not easy conditions, but survivable for humans¨, which explains why he believes that it is dangerous but since it is survivable it is worth the try.

Furthore more, the author gave great explainitory details of what could come if we live on Venus, that of the good and the bad. Throughout the text the author explains ways that Venus is dangerous but can be liveable towards humans. The authors explains ways of how the human population is trying to get to Venus by telling us about NASA

tryna build technology that is suitable for those conditions. The authors explains their idea with strong arguments and facts that make it understandable to theit idea.",5,2,0.8125511407852173,25.0,0.0,25.0
721fac1,"In this article, the author presents us with facts about what makes Venus dangerous, and why we should try to study it despite the danger that comes with it. He provides many examples of the harsh conditions of Venus, but is lacking when it comes to reasons why we should continue to study it. Safety is the number one priority in all scientific research, and I don't think this author provides enough reasons why studying Venus is worth the risk. Furthermore, when he does provide his reasons they are quickly proved wrong by himself in later paragraphs, which lowers his point immensly.

The author writes a lot about the challenges of going to Venus, and what makes Venus so dangerous. Yet, he barely provides any information on why it is important to go there. In paragraph 3 he writes, ""...such an environment would crush even a submarine accustumed to diving to the deepest parts of our oceans and would liquefy many metals."" He also writes about the extreme temperatures, 97% CO2 atmosphere, sulfuric acid clouds, and things like erupting volcanoes, earthquakes, and lightning strikes. All of these challenges and dangers in one paragraph, and not even one reason why we should face these challenges and go there. In the next paragraph he says, ""Long ago, Venus was probably covered largely with oceans and could have supported various forms of life, just like Earth."" He also go on to provide more information about how similar Venus is to our own planet, but still, no good reasons why we should spend money researching this planet. When you are talking about visiting a planet as dangerous as Venus, you need a lot of good reasons to go there. However, this author is lacking in his reasons, which makes him sound unprofessional.

Without providing a lot of research, it is hard to agree with what the author is saying. He does not do a great job of proving his point that Venus is a worthy pursuit despite the dangers it presents. In paragraph 5 he writes, ""NASA's possible solution to the hostile conditions on the surface of Venus would allow scientists to float above the fray. Imagine a blimp-like vehicle hovering 30 or so miles above the roiling Venusion landscape."" At first, this seems like a viable solution to the dangers of Venus, and sounds like a good way to safely research the planet more closely. However, it's quickly shot down and is identified as a less than desireable solution in the next paragraph by the author himself. He states facts about how we wouldn't be able to capture photographs from this distance through Venus's thick atmosphere. He also points out that we would not be able to retreive samples of rock, gas, or anything else from this distance. This is the only good possible solution to the dangers of Venus that the author has presented thus far, and he debunks the idea almost entirely in the very next paragraph. This is a terrible way to convince the readers of his opinion; that, despite the risks Venus presents, it is a worthy pursuit to study it.

In conclusion, the author presents more ideas that go against his point, than ideas that acually support it. He does a terrible job of supporting his ideas, and when he has a good point, he quickly proves to us himself that it is not a good idea at all. Taking all of these things into account, we can conclude that the author does a very poor job of supporting the idea that studying Venus is a worthy pursuit despite the dangers.    ",6,2,0.8332576751708984,0.0,0.0,0.0
