cluster_id,name,description,file,count,avg_score,std_score,score_distribution,avg_length,std_length
0,car_free_cities,Benefits of car-free or car-reduced cities,car_free_cities.csv,1972,3.0973630831643004,1.0587286173287824,"{3: 705, 4: 543, 2: 417, 5: 160, 1: 139, 6: 8}",2570.090770791075,1148.3768817698633
1,face_on_mars_evidence,Is the Face on Mars evidence of aliens or natural landform?,face_on_mars_evidence.csv,2092,2.852772466539197,0.9878878917681354,"{3: 787, 2: 683, 4: 390, 1: 124, 5: 91, 6: 17}",1802.965105162524,861.6570215517423
2,venus_exploration_worthiness,Is studying/exploring Venus a worthy scientific pursuit?,venus_exploration_worthiness.csv,3019,2.7926465717124875,1.1039714970203138,"{3: 1010, 2: 872, 4: 594, 1: 367, 5: 142, 6: 34}",1998.2510765154025,849.8761028644196
3,driverless_cars_policy,Arguments for/against driverless cars on public roads,driverless_cars_policy.csv,3487,3.219959850874677,0.9171488526374457,"{3: 1348, 4: 1140, 2: 695, 5: 220, 1: 74, 6: 10}",2172.6157155147694,807.6028689139381
4,emotion_recognition_schools,Should schools use emotion-recognition (FACS) technology?,emotion_recognition_schools.csv,1361,3.0529022777369583,0.9394112032681379,"{3: 592, 2: 348, 4: 301, 5: 71, 1: 34, 6: 15}",1927.746509919177,829.901865010841
5,electoral_college_debate,Should the U.S. keep or abolish the Electoral College?,electoral_college_debate.csv,2046,3.0034213098729228,1.1513733801651842,"{3: 674, 2: 513, 4: 466, 1: 191, 5: 170, 6: 32}",2317.768328445748,981.9345867266893
6,seagoing_cowboys_program,Persuade someone to join the Seagoing Cowboys program,seagoing_cowboys_program.csv,1648,2.470266990291262,0.8144651127390402,"{2: 721, 3: 606, 1: 161, 4: 150, 5: 10}",1531.5030339805826,549.6776733844874
7,emotion_recognition_schools,Should schools use emotion-recognition (FACS) technology?,emotion_recognition_schools.csv,1682,2.92627824019025,1.1540628646861422,"{3: 558, 2: 474, 4: 342, 1: 162, 5: 106, 6: 40}",2089.8293697978597,944.3096260531879
